{
  "$schema": "../schemas/model-lock.schema.json",
  "schema_version": "1.0.0",
  "default_generation_model": null,
  "default_embedding_model": null,
  "llama_cpp": {
    "repository": "https://github.com/ggml-org/llama.cpp",
    "tag": "b10082",
    "commit": "fb0e6b621917488d623437349fb5361e0ac21c70",
    "license_spdx": "MIT",
    "license_url": "https://github.com/ggml-org/llama.cpp/blob/fb0e6b621917488d623437349fb5361e0ac21c70/LICENSE",
    "source_asset_id": "llama.cpp-b10082-source",
    "cmake": {
      "minimum_version": "3.14",
      "generator": "Unix Makefiles",
      "build_type": "Release",
      "parallel_jobs": 1,
      "targets": [
        "llama-cli",
        "llama-server",
        "llama-embedding",
        "llama-bench"
      ],
      "common_options": [
        "-DBUILD_SHARED_LIBS=OFF",
        "-DLLAMA_BUILD_APP=OFF",
        "-DLLAMA_BUILD_COMMON=ON",
        "-DLLAMA_BUILD_EXAMPLES=ON",
        "-DLLAMA_BUILD_SERVER=ON",
        "-DLLAMA_BUILD_TESTS=OFF",
        "-DLLAMA_BUILD_TOOLS=ON",
        "-DLLAMA_BUILD_UI=OFF",
        "-DLLAMA_OPENSSL=OFF",
        "-DLLAMA_TOOLS_INSTALL=OFF",
        "-DLLAMA_USE_PREBUILT_UI=OFF",
        "-DGGML_ACCELERATE=OFF",
        "-DGGML_BACKEND_DL=OFF",
        "-DGGML_BLAS=OFF",
        "-DGGML_CANN=OFF",
        "-DGGML_CCACHE=OFF",
        "-DGGML_CPU=ON",
        "-DGGML_CUDA=OFF",
        "-DGGML_ET=OFF",
        "-DGGML_HEXAGON=OFF",
        "-DGGML_HIP=OFF",
        "-DGGML_LLAMAFILE=OFF",
        "-DGGML_METAL=OFF",
        "-DGGML_MUSA=OFF",
        "-DGGML_OPENCL=OFF",
        "-DGGML_OPENMP=OFF",
        "-DGGML_OPENVINO=OFF",
        "-DGGML_RPC=OFF",
        "-DGGML_STATIC=ON",
        "-DGGML_SYCL=OFF",
        "-DGGML_VIRTGPU=OFF",
        "-DGGML_VULKAN=OFF",
        "-DGGML_WEBGPU=OFF",
        "-DGGML_ZDNN=OFF",
        "-DGGML_ZENDNN=OFF"
      ],
      "profiles": {
        "portable": [
          "-DGGML_NATIVE=OFF",
          "-DGGML_CPU_ALL_VARIANTS=OFF",
          "-DGGML_CPU_KLEIDIAI=OFF",
          "-DGGML_SSE42=OFF",
          "-DGGML_AVX=OFF",
          "-DGGML_AVX_VNNI=OFF",
          "-DGGML_AVX2=OFF",
          "-DGGML_BMI2=OFF",
          "-DGGML_AVX512=OFF",
          "-DGGML_AVX512_VBMI=OFF",
          "-DGGML_AVX512_VNNI=OFF",
          "-DGGML_AVX512_BF16=OFF",
          "-DGGML_FMA=OFF",
          "-DGGML_F16C=OFF",
          "-DGGML_AMX_TILE=OFF",
          "-DGGML_AMX_INT8=OFF",
          "-DGGML_AMX_BF16=OFF",
          "-DGGML_LASX=OFF",
          "-DGGML_LSX=OFF",
          "-DGGML_RVV=OFF",
          "-DGGML_RV_ZFH=OFF",
          "-DGGML_RV_ZVFH=OFF",
          "-DGGML_RV_ZICBOP=OFF",
          "-DGGML_RV_ZIHINTPAUSE=OFF",
          "-DGGML_RV_ZVFBFWMA=OFF",
          "-DGGML_XTHEADVECTOR=OFF",
          "-DGGML_VXE=OFF"
        ],
        "native": [
          "-DGGML_NATIVE=ON",
          "-DGGML_CPU_ALL_VARIANTS=OFF",
          "-DGGML_CPU_KLEIDIAI=OFF"
        ]
      }
    }
  },
  "assets": [
    {
      "id": "llama.cpp-b10082-source",
      "kind": "source-archive",
      "status": "runtime-pinned",
      "default_eligible": false,
      "repository": "https://github.com/ggml-org/llama.cpp",
      "revision": "fb0e6b621917488d623437349fb5361e0ac21c70",
      "filename": "llama.cpp-b10082-fb0e6b621917.tar.gz",
      "url": "https://codeload.github.com/ggml-org/llama.cpp/tar.gz/fb0e6b621917488d623437349fb5361e0ac21c70",
      "allowed_hosts": [
        "codeload.github.com"
      ],
      "sha256": "06548322e6c4d14e363165b11d2d019d6b589d52a111ac6ad35d9849b0ecb220",
      "size_bytes": 35951126,
      "license_spdx": "MIT",
      "license_url": "https://github.com/ggml-org/llama.cpp/blob/fb0e6b621917488d623437349fb5361e0ac21c70/LICENSE",
      "redistribution": "not-bundled-download-on-demand",
      "quantization": null,
      "native_context_tokens": null,
      "qualification_spec": null,
      "extraction_root": "llama.cpp-fb0e6b621917488d623437349fb5361e0ac21c70"
    },
    {
      "id": "qwen3.5-2b-q4-k-m-candidate",
      "kind": "generation-model",
      "status": "unqualified",
      "default_eligible": false,
      "repository": "https://huggingface.co/bartowski/Qwen_Qwen3.5-2B-GGUF",
      "revision": "7d26695454df6de5fbcce2e58681e62dae06ce43",
      "filename": "Qwen_Qwen3.5-2B-Q4_K_M.gguf",
      "url": "https://huggingface.co/bartowski/Qwen_Qwen3.5-2B-GGUF/resolve/7d26695454df6de5fbcce2e58681e62dae06ce43/Qwen_Qwen3.5-2B-Q4_K_M.gguf?download=true",
      "allowed_hosts": [
        "huggingface.co",
        ".huggingface.co",
        ".hf.co"
      ],
      "sha256": "57a1085840f497d764a7fc5d346922dbde961efb54cc792ea81d694fd846a1d8",
      "size_bytes": 1396198496,
      "license_spdx": "Apache-2.0",
      "license_url": "https://huggingface.co/bartowski/Qwen_Qwen3.5-2B-GGUF/blob/7d26695454df6de5fbcce2e58681e62dae06ce43/README.md",
      "redistribution": "not-bundled-download-on-demand",
      "quantization": "Q4_K_M",
      "native_context_tokens": 262144,
      "qualification_spec": "models/qualification/rkc-local-model-v1.json",
      "extraction_root": null
    },
    {
      "id": "gemma-4-e2b-it-qat-q4-0-candidate",
      "kind": "generation-model",
      "status": "unqualified",
      "default_eligible": false,
      "repository": "https://huggingface.co/google/gemma-4-E2B-it-qat-q4_0-gguf",
      "revision": "675cff42a74c774d6cb76f76d8eacb49b48c9b93",
      "filename": "gemma-4-E2B_q4_0-it.gguf",
      "url": "https://huggingface.co/google/gemma-4-E2B-it-qat-q4_0-gguf/resolve/675cff42a74c774d6cb76f76d8eacb49b48c9b93/gemma-4-E2B_q4_0-it.gguf?download=true",
      "allowed_hosts": [
        "huggingface.co",
        ".huggingface.co",
        ".hf.co"
      ],
      "sha256": "fa401b55b07ee70a54c6dae3903c783a6e65064312529ea57175cb5f8dec6634",
      "size_bytes": 3349516256,
      "license_spdx": "Apache-2.0",
      "license_url": "https://huggingface.co/google/gemma-4-E2B-it-qat-q4_0-gguf/blob/675cff42a74c774d6cb76f76d8eacb49b48c9b93/README.md",
      "redistribution": "not-bundled-download-on-demand",
      "quantization": "Q4_0",
      "native_context_tokens": 131072,
      "qualification_spec": "models/qualification/rkc-local-model-v1.json",
      "extraction_root": null
    },
    {
      "id": "qwen3-embedding-0.6b-q8-0-candidate",
      "kind": "embedding-model",
      "status": "unqualified",
      "default_eligible": false,
      "repository": "https://huggingface.co/Qwen/Qwen3-Embedding-0.6B-GGUF",
      "revision": "370f27d7550e0def9b39c1f16d3fbaa13aa67728",
      "filename": "Qwen3-Embedding-0.6B-Q8_0.gguf",
      "url": "https://huggingface.co/Qwen/Qwen3-Embedding-0.6B-GGUF/resolve/370f27d7550e0def9b39c1f16d3fbaa13aa67728/Qwen3-Embedding-0.6B-Q8_0.gguf?download=true",
      "allowed_hosts": [
        "huggingface.co",
        ".huggingface.co",
        ".hf.co"
      ],
      "sha256": "06507c7b42688469c4e7298b0a1e16deff06caf291cf0a5b278c308249c3e439",
      "size_bytes": 639150592,
      "license_spdx": "Apache-2.0",
      "license_url": "https://huggingface.co/Qwen/Qwen3-Embedding-0.6B-GGUF/blob/370f27d7550e0def9b39c1f16d3fbaa13aa67728/README.md",
      "redistribution": "not-bundled-download-on-demand",
      "quantization": "Q8_0",
      "native_context_tokens": 32768,
      "qualification_spec": "models/qualification/rkc-local-model-v1.json",
      "extraction_root": null
    }
  ]
}
